{
  "schema_version": "14.0",
  "document_sha256": "7c518a24f9bd98fbfeedfe4806e1879299aaa8bd2b72d6b019e4a6afaca9d644",
  "status": "unresolved",
  "scope": "Not established in this illustrative fixture.",
  "assumptions": "Not established in this illustrative fixture.",
  "objections": "Not established in this illustrative fixture.",
  "evidence_references": "Not established in this illustrative fixture.",
  "next_inquiry": "Not established in this illustrative fixture.",
  "group_coverage": "Not established in this illustrative fixture.",
  "thresholds": "Not established in this illustrative fixture.",
  "peace_assessment": "unresolved",
  "execution_authority": false,
  "identity_authenticated": false,
  "behavioral_commitment_verified": false
}
